Fund Name,Type,Total Commitment,Called Capital,Remaining,Current Value,Called %,Remaining %
Industrial Technology Fund IV,Private Equity,€ 2.200.000,€ 2.090.000,€ 110.000,€ 2.420.000,95.00%,5.00%
Global Clean Energy Infrastructure,Infrastructure,€ 1.400.000,€ 1.260.000,€ 140.000,€ 1.470.000,90.00%,10.00%
Americas Real Estate Partners,Real Estate,€ 1.800.000,€ 1.620.000,€ 180.000,€ 1.890.000,90.00%,10.00%
Emerging Markets Growth Equity,Growth Equity,€ 1.000.000,€ 950.000,€ 50.000,€ 1.100.000,95.00%,5.00%
Asia Pacific Tech Ventures III,Venture Capital,€ 600.000,€ 480.000,€ 120.000,€ 660.000,80.00%,20.00%
